{
  "request_id": "req-cart-cfm-001-abc123xyz",
  "intent_id": "urn:uuid:550e8400-e29b-41d4-a716-446655440000",
  "delegation_id": "urn:uuid:7f3e9a12-b4c8-4d56-a321-8b7c6d5e4f30",
  "buyer_agent_id": "did:act:example.com/agent-alice-001",
  "merchant_id": "did:act:example.com/merchant-shop-001",
  "merchant_order_id": "MCH20240514123456789",
  "cart_snapshot": {
    "items": [
      {
        "product_id": "PROD-001-NB-14",
        "product_name": "轻薄笔记本 AirBook Pro 14 英寸",
        "category": "electronics/laptop",
        "price": "8999.00",
        "quantity": 1,
        "subtotal": "8999.00"
      },
      {
        "product_id": "ACC-001-MSC",
        "product_name": "无线鼠标",
        "category": "electronics/accessory",
        "price": "199.00",
        "quantity": 1,
        "subtotal": "199.00"
      }
    ],
    "snapshot_hash": "sha256:a1b2c3d4e5f6a1b2c3d4e5f6a1b2c3d4e5f6a1b2c3d4e5f6a1b2c3d4e5f6a1b2"
  },
  "shipping_fee": "0.00",
  "discount_amount": "50.00",
  "total_amount": "9148.00",
  "currency": "CNY",
  "delivery_requirements": {
    "delivery_address": "北京市朝阳区某某街道 123 号",
    "estimated_delivery_time": "2024-05-19T10:00:00Z"
  },
  "timestamp": "2024-05-14T12:30:45Z",
  "reference_payment_info": {
    "payment_method": "urn:act:payment:example-wallet",
    "psp_id": "urn:act:psp:example-psp",
    "psp_endpoint": "https://api.example-psp.com/act-psp/v1"
  },
  "signature": "MEYCIQDtv8Qw3Xv6kZnP2mJaLcR5oN1yFgHsIbKdWxPqE7u4vAIhAOzR9sYmCnXpL3kQwBjTfN2aGdHe5VuMrXoIPcKs8Zt1"
}